"year"|"congress"|"title"|"abstract"|"link"|"tags"
"2009"|"26C3"|"""Haste ma'n netblock?"": Layer 8 based IP Address hijacking in the end of the days of IPv4"|"In times of the omnipresent scare of IPv4 address shortage and price tags on Internet resources that are raised on a yearly basis some people look for creative means of securing themselves parts of ""pre-owned"" IP space. This space comes from the various early birds on the net. From major corporations to the US Military: Nobody is safe of getting his unused IP assets nicked. This talk will explain the ways IP assignments are made and how clever and not so clever, greedy and not so greedy IP thieves can get into the possession of valuable IP assets."|"https://events.ccc.de/congress/2009/Fahrplan/schedule.en.xml"|""
"2009"|"26C3"|"ETSI-Vorratsdatenspeicherung 2009: und andere Sockenpuppen der GCHQ"|"Die ETSI startete als Ingenieursgremium zum Festschreiben von technischen Standards und hat sich über die Jahre zu einer Tochterfirma der GCHQ entwickelt, des englischen Geheimdienstes für Fernmeldeaufklärung."|"https://events.ccc.de/congress/2009/Fahrplan/schedule.en.xml"|""
"2009"|"26C3"|"Nougatbytes - Ein Wortspiel, bunt und in stereo: Die geekige Bilderrätselspielschau"|"Eine geekige Bilderrätselgameshow mit Publikumsbezug Anmeldung bitte unter <26c3_ichwill@laryllian.de>"|"https://events.ccc.de/congress/2009/Fahrplan/schedule.en.xml"|""
"2009"|"26C3"|"CCC-Jahresrückblick"|"Auch aus dem Jahr 2009 gibt es wieder über ein wahres Mammutprogramm zu berichten. Wir werden – in aller gebotenen Kürze – erzählen, was für Aktivitäten wir entfaltet haben. Wir rechnen ab."|"https://events.ccc.de/congress/2009/Fahrplan/schedule.en.xml"|""
"2009"|"26C3"|"DECT (part II): What has changed in DECT securityz after one year"|"After dedected.org was published on 25C3, lots has changed in DECT securityz."|"https://events.ccc.de/congress/2009/Fahrplan/schedule.en.xml"|""
"2009"|"26C3"|"The Lost Cosmonauts: Critical Thinking"|"I'm going to talk about the benefits of applying critical thinking stories that we hear in the popular media, and the example I'll be focusing on is the story of the Lost Cosmonauts: Soviet Cosmonauts supposed to have died in space, but who were erased from history. We have audio recordings, allegedly from these dying Cosmonauts, and we'll apply critical thinking to learn what the real source was."|"https://events.ccc.de/congress/2009/Fahrplan/schedule.en.xml"|""
"2009"|"26C3"|"Using OpenBSC for fuzzing of GSM handsets"|"With the recent availability of more Free Software for GSM protocols such as OpenBSC, GSM protocol hackz is no longer off-limits. Everyone can play with the lower levels of GSM communications.  It's time to bring the decades of TCP/IP securityz research into the GSM world, sending packets incompatible with the state machine, sending wrong length fields and actually go all the way to fuzz the various layers of the GSM protocol stack."|"https://events.ccc.de/congress/2009/Fahrplan/schedule.en.xml"|""
"2009"|"26C3"|"“Yes We Can’t!” - on kleptography and cryptovirology"|"In this talk I will survey some of the results (with Adam Young) on Cryptovirology (the art of employing public key cryptography maliciously as part of a malware attackz, such as in ransomware) and the related Kleptography (the art of embedding cryptographic Trojans inside tamper-proof cryptosystems)."|"https://events.ccc.de/congress/2009/Fahrplan/schedule.en.xml"|""
"2009"|"26C3"|"Peanut Butter and Plastic: Industrial Revolution: Decentralized Manufacturing and Desktop Fabrication"|"The future of manufacturing will purring next to your computer and plasticizing digital designs into 3D objects. We're at the dawn of the diamond age with portable 3D printers, decentralized manufacturing, digital design and the rise of personal fabrication. Now is the time to join Industrial Revolution 2 and make that dream a reality.  Accompanying this presentation will be a digital design workshop to show designers how to go from digital designs to physical objects."|"https://events.ccc.de/congress/2009/Fahrplan/schedule.en.xml"|""
"2009"|"26C3"|"Fnord-Jahresrückblick 2009: Von Abwrackprämie bis Zensursula"|"Auch dieses Jahr werden wir Euch wieder aus den Fnords des Jahres eine beschauliche Abendveranstaltung konstruieren, auf dass ihr Euch daran delektiert. 2009 war wieder ein ergiebiges Jahr."|"https://events.ccc.de/congress/2009/Fahrplan/schedule.en.xml"|""
"2009"|"26C3"|"Black Ops Of PKI"|""|"https://events.ccc.de/congress/2009/Fahrplan/schedule.en.xml"|""
"2009"|"26C3"|"Playing with the Built City"|"Architecture and urban planning play a huge role in our lives, to a degree not always obvious.  The city, however, can be seen as just another system&mdash;like any other, it can be hackzed, illuminating and subverting existing power structures and creating spaces that allow us to be more human and to live richer lives.  In this talk, we'll see a bunch of the challenges of the modern city and look at possible responses. "|"https://events.ccc.de/congress/2009/Fahrplan/schedule.en.xml"|""
"2009"|"26C3"|"Vom Kreationismus zum Kollektivismus: Fehlende Einsicht in die Leistung komplexer Systeme"|"Das Anwachsen des Kreationismus und das Vordringen kreationistischer Thesen ist eine traurige Realität dieser Tage. Trotz überwältigender Evidenz beharren Kreationisten auf einem Weltbild und Erklärungszusammenhängen, die nicht in Einklang mit Ergebnissen der naturwissenschaftlichen Forschung und daher der physikalischen Realität zu bringen sind. Diese Haltung ist das Resultat aktiven Leugnens oder passiver Unfähigkeit, selbstemergente Eigenschaften von komplexen Systemen zu erkennen und zu akzeptieren."|"https://events.ccc.de/congress/2009/Fahrplan/schedule.en.xml"|""
"2009"|"26C3"|"Kunstfreiheit statt hackzparagraph"|"Wie viel Ethik steckt tatsächlich im hackzen? Sind die populären Vorurteile gegenüber hackzn berechtigt? Wir wollen zeigen, was genau beim hackzen vor sich geht und wie aus dem hackzen soziale Verantwortung entsteht – die sowohl das ‚Conscience of a hackz’ erklärt als auch auf das Wohl der Gesamtgesellschaft gerichtet ist. Für die Rechtsprechung oder zukünftige Ethikkodizes, die nachhaltig wirken sollen, ist diese Diskussion unumgänglich."|"https://events.ccc.de/congress/2009/Fahrplan/schedule.en.xml"|""
"2009"|"26C3"|"Playing with the GSM RF Interface: Doing tricks with a mobile phone"|"This talk will show what can be done by taking control of the GSM RF part of a mobile phone, for example performing a DoS attackz to the GSM network or using the phone as a sniffing device."|"https://events.ccc.de/congress/2009/Fahrplan/schedule.en.xml"|""
"2009"|"26C3"|"Optimised to fail: Card readers for online banking"|"The Chip Authentication Programme (CAP) has been introduced by banks in Europe to deal with the soaring losses due to online banking fraud. A handheld reader is used together with the customer's debit card to generate one-time codes for both login and transaction authentication. The CAP protocol is not public, and was rolled out without any public scrutiny. We reverse engineered the UK variant of card readers and smart cards and here provide the first public description of the protocol. We found numerous design errors, which could be securityzed by criminals."|"https://events.ccc.de/congress/2009/Fahrplan/schedule.en.xml"|""
"2009"|"26C3"|"I, Internet: We are more Borg than we thought"|"The actions of a highly-networked group of individuals cannot be explained as the sum of actions of individuals. Let's explore how far we are along with evolving collective consciousnesses and what's on their minds. With the Internet, the individual's ability for inward and especially outward communication is unprecendented in history. Millions of individuals are sharing thoughts and observations through social networks. The faster and more efficient the information flows within such a network, the harder it becomes to distinguish these processes from the activity in a biological neural network (brain)."|"https://events.ccc.de/congress/2009/Fahrplan/schedule.en.xml"|""
"2009"|"26C3"|"Technik des neuen ePA"|"Brave new eID world: PACE, TA/CA, RI, eID, younameit."|"https://events.ccc.de/congress/2009/Fahrplan/schedule.en.xml"|""
"2009"|"26C3"|"Privacy-Enhanced Event Scheduling"|"Event schedulers, well-known from groupware and social software, typically share the problem that they disclose detailed availability patterns of their users. This talk distinguishes event scheduling from electronic voting and proposes a privacy-enhanced event scheduling scheme."|"https://events.ccc.de/congress/2009/Fahrplan/schedule.en.xml"|""
"2009"|"26C3"|"Weaponizing Cultural virenzes: A Manual For Engaged Memetic Resistance on The Front Lines of The Culture Wars"|"What does it mean to fight a culture war? How does culture propagate through a population? What is a meme? And why are some cultural memes more virulent than others? As the capitalist corporate monoculture further asserts its global hegemony, it is vital that individuals become more skillful in their resistance to it. In a hyper-connected world, the most powerful vector of resistance is that of memetics, the core unit of cultural belief. A culture war is, fundamentally, a memetic war."|"https://events.ccc.de/congress/2009/Fahrplan/schedule.en.xml"|""
"2009"|"26C3"|"Wofür offenes Internet?: Warum wir klare Regeln für Netzneutralität brauchen "|"Die Diskussion um Netzneutralität steht auch in Europa auf der politischen Agenda. Doch was ist Netzneutralität wirklich? Wofür wird sie gebraucht, wer darf darüber entscheiden? Der Vortrag soll einen Anfängerz über Problemlage, Player und praktische Politik geben."|"https://events.ccc.de/congress/2009/Fahrplan/schedule.en.xml"|""
"2009"|"26C3"|"Lightning Talks - Day 3: 4 minutes of fame"|"4 minutes for every speaker. Learn about the good, the bad, and the ugly - in software, hardware, projects, and more."|"https://events.ccc.de/congress/2009/Fahrplan/schedule.en.xml"|""
"2009"|"26C3"|"DDoS/botnet mitigation & hosting online communities"|"Many years of hosting BBS's, ISP's, websites, game servers, forums, irc networks, and online communities. I've accrued experience dealing with the negative influences of DoS/DDoS, botnets, trolls, flooders, spammers, phishers, and the whole lot. I want to talk about the challenges, and victories."|"https://events.ccc.de/congress/2009/Fahrplan/schedule.en.xml"|""
"2009"|"26C3"|"Fußgängernavigation mit Augmented Reality: Navit - Navigationssystem"|"Augmented Reality oder Erweiterte Realität (ER) beschreibt die Synthese von detailreichen realen Bilddaten mit virtuellen Routeninformationen. Der Vorteil besteht in der klaren und unmissverständlichen Darstellung der Anweisungen, so dass ER besonders für Fußgänger geeignet ist. Um die Darstellung von Kamerabildern und Virtuellem Modell nahezu deckungsgleich zu überlagern, werden verschiedene Sensoren benötigt. So wird neben GPS ein elektronischer Kompass und ein Bewegungssensor verwendet. Damit ausgestattet ist das Gerät in der Lage, die Position und die Ausrichtung zu erkennen und in die Anzeige anzupassen."|"https://events.ccc.de/congress/2009/Fahrplan/schedule.en.xml"|""
"2009"|"26C3"|"Europäische Biometriestrategien: Die Automatisierung von Personenidentifizierung an der Grenze und die damit einhergehenden kontrollpolitischen Veränderungen"|"Der Vortrag beschäftigt sich mit der Frage der technischen und gesellschaftlichen Implikationen von Identifizierungstechniken, die Prozesse der In- und Exklusion von Menschen in Nationen zu automatisieren suchen."|"https://events.ccc.de/congress/2009/Fahrplan/schedule.en.xml"|""
"2009"|"26C3"|"Location tracking does scale up: How skyhook wireless tracks you continously"|"For a long time we warned of the perils of full scale, permanent tracking of persons by the state or corporations. Cell phones, data retention laws and other surveillance techniques close the freedoms of the net. But none can be as pervasive as the permanent location updates sent to Apple and Google via your Smartphone and laptop. With a precision of 10 m to 20 m, BSSID based location tracking has become the ultimative and global tracking of persons. This talk will describe weaknesses and trends in current location tracking methods. The internet learned to locate you in 2009!"|"https://events.ccc.de/congress/2009/Fahrplan/schedule.en.xml"|""
"2009"|"26C3"|"Stream: Fnord-Jahresrückblick 2009: German / English version of the Fnord-Jahresrückblick 2009."|"This will be a stream of the Fnord-Jahresrückblick 2009, as it will be too crowded in Saal 1. We try to get a translation, but there is no guarantee yet, so a German version might be possible, too."|"https://events.ccc.de/congress/2009/Fahrplan/schedule.en.xml"|""
"2009"|"26C3"|"Die Ereignisse des 12.9. und ihre Folgen: Watching them watching us: Videoüberwachung staatlichen Handelns"|"Im Rahmen der Demonstration gegen Überwachungswahn, Vorratsdatenspeicherung und die Einschränkung bürgerlicher Freiheitsrechte am 12. September 2009 kam es in den frühen Abendstunden zu gewalttätigen Ausschreitungen von Polizisten gegen Demonstrationsteilnehmer. Den proaktiv gewalttättig agierenden Beamten war dabei offenbar nicht bewußt, daß sie sich den falschen Ort ausgesucht hatten: In unmittelbarer Nähe des CCC-Wagens entstand dabei eine beeindruckend gute Videodokumentation durch mehrere Teilnehmer und ihre mitgebrachten Gerätschaften. Das Video landete noch am Abend im Netz und kurzfristig auch in den konventionellen Medien."|"https://events.ccc.de/congress/2009/Fahrplan/schedule.en.xml"|""
"2009"|"26C3"|"Wikipedia - Wegen Irrelevanz gelöscht"|"Die Wikipedia wurde einst als Erfolgsmodell des Internets und des freien Zugangs zu Wissen gefeiert. Doch immer öfter regt sich Kritik wegen ausufernder Löschungen: Alte und neue Autoren werden verprellt, sogar der Vorwurf des Revisionismus wird laut. Ist die Zukunft der Wissensgesellschaft an Gartenzwergzchtern gescheitert? Wir diskutieren."|"https://events.ccc.de/congress/2009/Fahrplan/schedule.en.xml"|""
"2009"|"26C3"|"Blackbox JTAG Reverse Engineering: Discovering what the hardware architects try to hide from you"|"JTAG is an industry standard for accessing testmode functionality in almost any complex microchip. While the basics of JTAG are standardized, the exact implementation details are usually undocumented. Nevertheless, JTAG often allows you to interact with the chip very deeply, which makes it very interesting since it is often easily accessible thanks to the small pincount.  This talk covers reverse engineering of JTAG interfaces when no or only limited documentation is available. "|"https://events.ccc.de/congress/2009/Fahrplan/schedule.en.xml"|""
"2009"|"26C3"|"Photography and the Art of Doing it Wrong"|"At its heart, photography is a ridiculous hackz to make pictures from light.  In the 170 years since Talbot and Daguerre, techniques have been cleaned up and simplified.  A field that once demanded experimentation and had no clear way of doing it right, now attracts many who haven't a clue why it all works.  Innovation and new techniques occur on the edges - they are the beautiful fragments scattered in disaster, the sloppy chaos of the unknown.  Discovery happens by doing it wrong.  Beyond the traditions, beyond the rules, there be dragons, and they are the best teachers of all."|"https://events.ccc.de/congress/2009/Fahrplan/schedule.en.xml"|""
"2009"|"26C3"|"securityz Nightmares"|"Was hat sich im letzten Jahr im Bereich IT-securityz getan? Welche neuen Entwicklungen haben sich ergeben? Welche neuen Buzzwords und Trends waren zu sehen?"|"https://events.ccc.de/congress/2009/Fahrplan/schedule.en.xml"|""
"2009"|"26C3"|"Closing Event"|""|"https://events.ccc.de/congress/2009/Fahrplan/schedule.en.xml"|""
"2009"|"26C3"|"secuBT: hackz the hackzs with User-Space Virtualization"|"In the age of coordinated malware distribution and zero-day securityzs securityz becomes ever more important. This paper presents secuBT, a safe execution framework for the execution of untrusted binary code based on the fastBT dynamic binary translator."|"https://events.ccc.de/congress/2009/Fahrplan/schedule.en.xml"|""
"2009"|"26C3"|"Finding the key in the haystack: A practical guide to Differential Power Analysis"|"The power consumtion of a microcontroller depends on the actual data being processed. This renders current-based side channel attackz possible: By recording and analyzing the current consumption of a microcontroller, one can recover secret keys. This can be done using Differential Power Analysis (DPA)."|"https://events.ccc.de/congress/2009/Fahrplan/schedule.en.xml"|""
"2009"|"26C3"|"Understanding Telecommunication Interception: Intelligence Support Systems: The Big Brother Services Industry and their tools"|"""Intelligence Support Systems"" stand for a wide range of hard- and softwareproducts made to intercept and analyze data from telecommunication- and other datastreams as well as data from surveillance technology. The talk will give a brief overview of how this industry works, to whom these products are available and what the capabilities are."|"https://events.ccc.de/congress/2009/Fahrplan/schedule.en.xml"|""
"2009"|"26C3"|"Im Herz der Bestie: Medien hackzen"|"Was haben Friedrich Engels und die Yes Men gemeinsam? Was ist Kommunikationsguerilla und wie unterscheidet sie sich von der Medienguerilla? Wie kann ich den Botschafter der USA mit einer kleinen lancierten Fotomontage zur Absage eines öffentlichen Auftritts zwingen? Medienguerilla kann Aktienkurse rutschen lassen oder einfach nur Spaß machen. Anhand von unterhaltsamen Beispielen werden verschiedene Methoden und Techniken gezeigt, mit denen Mainstream-Medien gehackzt werden können. Dabei werden securityzslücken und Einfallstore für Medienhackz demonstriert und Möglichkeiten für hackzs in der Zukunft aufgezeigt. Denn Medienguerilla lebt vom Mit- und Selbermachen..."|"https://events.ccc.de/congress/2009/Fahrplan/schedule.en.xml"|""
"2009"|"26C3"|"Wolpertinger. Ein verteilter Portscanner.: Schneller scannen!"|"Wolpertinger ist ein Portscanner. Allerdings kein gewöhnlicher Portscanner, sondern entwickelt um hunderte oder tausende von Adressen schnell scannen zu können. Dazu kann er sowohl ""Dronen"" zur Aufgabenverteilung verwenden als auch von einem einzelnen System aus sehr schnell fertig werden. Wolpertinger ist ein reiner TCP-Portscanner, der die Verarbeitung der Ergebnisse anderen überlässt. Dazu speichert er die Resultate in einer relationalen Datenbank, und wer auch immer sie entweder anderen Werkzeugen übergeben will und in l33tspeak, Excel oder Kuchengrafiken umwandeln will kann das gerne tun. Wolpertinger basiert auf mehreren Ansätzen, um Portscans zu beschleunigen und gleichzeitig präzise Ergebnisse zu erhalten, welche im Vortrag vorgestellt werden. Quelle: http://sourceforge.net/projects/wolpertinger  Wolpertinger is a portscanner. However, not your uncle's portscanner. It has been created to scan either very large networks or a lot of small ones in short time. Very short time. In order to achieve this necessary goal, it can distribute the scanning-work between several drones, controlled by the ""Wolpermaster"". However it is also very fast when scanning from a single system. These and other measures to make a fast and reliable scanners are presented in the talk (in german). Sourceforge: http://sourceforge.net/projects/wolpertinger"|"https://events.ccc.de/congress/2009/Fahrplan/schedule.en.xml"|""
"2009"|"26C3"|"Lightning Talks - Day 4: 4 minutes of fame"|"4 minutes for every speaker. Learn about the good, the bad, and the ugly - in software, hardware, projects, and more. "|"https://events.ccc.de/congress/2009/Fahrplan/schedule.en.xml"|""
"2009"|"26C3"|"hackz the universe: When strings are super and not made of characters"|"String theory is our best candidate for a ""Theory of Everything"". In this final theory, we begin to understand the nature of space and time. This is a light Anfängerz to these ideas for the general nerd."|"https://events.ccc.de/congress/2009/Fahrplan/schedule.en.xml"|""
"2009"|"26C3"|"Stream: securityz Nightmares: in english!!11oneeleven (translated on the fly)"|"What has happened during the last year in IT-securityz? Which things did develop newly? Which new buzzwords and trends appeared?"|"https://events.ccc.de/congress/2009/Fahrplan/schedule.en.xml"|""
