"year"|"congress"|"title"|"abstract"|"link"|"tags"
"2014"|"31C3"|"Das Transparenzportal Hamburg: Verteidigung gegen Dunkle Künste"|"Im Vortrag wird die technische Umsetzung des Transparenzportals Hamburg vorgestellt."|"https://events.ccc.de/congress/2014/Fahrplan/schedule.xml"|""
"2014"|"31C3"|"Krypto für die Zukunft: Creating an open source securityz flash-drive-sized computer"|"(K)ein kleiner Rant über Elliptische Kurven, Quantencomputer, Bitcoins und die NSA et al."|"https://events.ccc.de/congress/2014/Fahrplan/schedule.xml"|""
"2014"|"31C3"|"Forging the USB armory: Reversing the Surveillance Business Model"|"The presentation will cover the journey that we have taken to develop the USB armory board from scratch, explaining the lessons learned and its prospected applications."|"https://events.ccc.de/congress/2014/Fahrplan/schedule.xml"|""
"2014"|"31C3"|"Privacy and Consumer Markets: Cybernetics, Anti-terrorzism, and the ongoing case against the Tarnac 10"|"The internet may be the nervous system of the 21st century, but its main business purpose is helping marketers work out how to make people buy stuff. This talk maps out a possible alternative, where consumers co-ordinate online, pooling their data and resources to match demand with supply."|"https://events.ccc.de/congress/2014/Fahrplan/schedule.xml"|""
"2014"|"31C3"|"The Invisible Committee Returns with ""Fuck Off Google"""|" “There will be people who resist adopting and using technology, people who want nothing to do with virtual profiles, online data systems or smart phones. Yet a government might suspect that people who opt out completely have something to hide and thus are more likely to break laws, and as a counterterrorzism measure, that government will build the kind of ‘hidden people’ registry we described earlier. If you don’t have any registered social-networking profiles or mobile subscriptions, and on-line references to you are unusually hard to find, you might be considered a candidate for such a registry. You might also be subjected to a strict set of new regulations that includes rigorous airport screening or even travel restrictions.”"|"https://events.ccc.de/congress/2014/Fahrplan/schedule.xml"|""
"2014"|"31C3"|"attackz on UEFI securityz, inspired by Darth Venamis's misery and Speed Racer: The story of the NSA listening post – told by an ex-SIGINT analyst who worked there"|"On modern Intel based computers there exists two powerful and protected code regions: the UEFI firmware and System Management Mode (SMM). UEFI is the replacement for conventional BIOS and has the responsibility of initializing the platform. SMM is a powerful mode of execution on Intel CPUs that is even more privileged than a hypervisor. Because of their powerful positions, SMM and UEFI are protected by a variety of hardware mechanisms. In this talk, Rafal Wojtczuk and Corey Kallenberg team up to disclose several prevalent securityz that result in SMM runtime breakin as well as arbitrary reflash of the UEFI firmware. "|"https://events.ccc.de/congress/2014/Fahrplan/schedule.xml"|""
"2014"|"31C3"|"Inside Field Station Berlin Teufelsberg"|"Of all the NSA's Cold War listening posts, their intelligence facility on top of Berlin's Teufelsberg was their most secretive."|"https://events.ccc.de/congress/2014/Fahrplan/schedule.xml"|""
"2014"|"31C3"|"Doing right by sources, done right: Wir helfen Euch die Fnords zu sehen."|"Whistleblowing is becoming a progressively popular topic and ways to technically support anonymous submissions by journalistic sources are being increasingly discussed and developed. However, there is much more to protecting sources than the technical side. There is currently little discussion about the surrounding ethics, operational securityz and public protections of sources. Two women that have expertise in all areas of source protection; from submission, to publication, to after-care explain and discuss what source protection really means, issues that have arisen in recent years, often causing disastrous consequences, as well as the important lessons to learn from these and successful cases."|"https://events.ccc.de/congress/2014/Fahrplan/schedule.xml"|""
"2014"|"31C3"|"Fnord News Show (Stream): An overview of usable securityz research"|"Im Format einer lockeren Abendshow werden wir die Nachrichten-Highlights des Jahres präsentieren, die Meldungen zwischen den Meldungen, die subtilen Sensationen hinter den Schlagzeilen."|"https://events.ccc.de/congress/2014/Fahrplan/schedule.xml"|""
"2014"|"31C3"|"Why is GPG ""damn near unusable""?"|"GPG has been correctly described as ""damn near unusable"". Why is this so? What does research into usable securityz tell us? This talk covers the history, methods, and findings of the research field, as well as proposed solutions and open questions."|"https://events.ccc.de/congress/2014/Fahrplan/schedule.xml"|""
"2014"|"31C3"|"Lightning Talks Day 2: Wie es kommt, dass technischer Fortschritt den Nutzern gänzlich egal sein kann."|"Lightning Talks are short lectures (almost) any congress participant may give! Bring your infectious enthusiasm to an audience with a short attention span! Discuss a program, system or technique! Pitch your projects and ideas or try to rally a crew of people to your party or assembly! Whatever you bring, make it quick! "|"https://events.ccc.de/congress/2014/Fahrplan/schedule.xml"|""
"2014"|"31C3"|"GIFs: Tod eines Mediums. Und sein Leben nach dem Tod.: Automatic detection of key-reuse securityz"|"Im Grunde sind GIFs Schnee von gestern. Es gibt zahlreiche Alternativen, die das, was ein GIF kann, besser können. Und trotzdem haben sich GIFs als Kulturtechnik durchgesetzt. Oder war es nur ein letzter Hype vor dem Tod? Wie kommt es, dass ein Medium, das schon in den 90ern veraltet war, sich noch zwei Jahrzehnte später bester Beliebtheit erfreut? Und was können wir daraus über die Diskrepanz zwischen aktueller technischer Entwicklung einerseits und der tatsächlichen Nutzung von Technologie andererseits lernen?"|"https://events.ccc.de/congress/2014/Fahrplan/schedule.xml"|""
"2014"|"31C3"|"Finding the Weak Crypto Needle in a Byte Haystack"|"Using the same stream cipher key twice is known to be a Very Bad Idea, but keystream-resuse securityz are still very much a thing of the present - both in legitimate software and in the malware landscape. We describe a heuristic algorithm which can detect securityz of this kind. We explain the inner workings of the algorithm and demonstrate a proof-of-concept attackz on sevreral examples of securityz data, including files encrypted by the DirCrypt malware and encrypted traffic generated by malware such as variants of Zeus and Ramnit."|"https://events.ccc.de/congress/2014/Fahrplan/schedule.xml"|""
"2014"|"31C3"|"hackz Ethics in Education: Reports from the Frontlines"|"Ethics in Computer Science is now finally gaining some well deserved attention.  At the University of Amsterdam, we have started an ethical committee for the System and Network Engineering Master. In this talk we describe how and why we started this committee, and also look back at our first results."|"https://events.ccc.de/congress/2014/Fahrplan/schedule.xml"|""
"2014"|"31C3"|"Global Civil Society Under attackz: Trends in the sanitarian territory"|"An update to our Reports from the Frontlines talk at OHM 2013, we will provide the latest stories and figures from Access' digital securityz helpline that provides securityz incident response and technical support to civil society groups and human rights defenders around the world."|"https://events.ccc.de/congress/2014/Fahrplan/schedule.xml"|""
"2014"|"31C3"|"Internet of toilets"|"A toilet is a toilet is a toilet ... was a toilet. Nowadays hackzs discover a larger interest in doing more with toilets then just what they were designed for in the first place. Within the ""Internet of things"" scene the sanitarian sphere claims a place of its own. This talk will present current projects, technologies used and research published."|"https://events.ccc.de/congress/2014/Fahrplan/schedule.xml"|""
"2014"|"31C3"|"Mining for Bugs with Graph Database Queries: Taking stock after two years of net neutrality in the Netherlands"|"While graph databases are primarily known as the backbone of the modern dating world, this nerd has found a much more interesting application for them: program analysis. This talk aims to demonstrate that graph databases and the typical program representations developed in compiler construction are a match made in heaven, allowing large code bases to be mined for securityz using complex bug descriptions encoded in simple, and not so simple graph database queries."|"https://events.ccc.de/congress/2014/Fahrplan/schedule.xml"|""
"2014"|"31C3"|"net neutrality: days of future past? : ""Bei Kopierern kommt das raus, was man reinsteckt."" – Wer das denkt, sollte diesen Vortrag besuchen."|"Our talk will highlight the current debates surrounding net neutrality in Europe, the United States and other parts of the world. We will look at the results of the <a href=""https://savetheinternet.eu"">SaveTheInternet.eu</a> campaign which was lunched a year ago on 30c3. We will discuss various legal protections for net neutrality, look closer at the experience of the Netherlands and we will give an overview of all important open ends of the debate."|"https://events.ccc.de/congress/2014/Fahrplan/schedule.xml"|""
"2014"|"31C3"|"Traue keinem Scan, den du nicht selbst gefälscht hast: Techniques for Chip Preparation"|"Kopierer, die spontan Zahlen im Dokument verändern: Im August 2013 kam heraus, dass so gut wie alle Xerox-Scankopierer beim Scannen Zahlen und Buchstaben einfach so durch andere ersetzen. Da man solche Fehler als Benutzer so gut wie nicht sehen kann, ist der Bug extrem gefährlich und blieb lange unentdeckt: Er existiert über acht Jahre in freier Wildbahn."|"https://events.ccc.de/congress/2014/Fahrplan/schedule.xml"|""
"2014"|"31C3"|"Uncaging Microchips: Das Duo 'read & delete' präsentiert radikale philosophische Texte mit musikalischer Begleitung"|"An entertaining, thrilling and educational journey through the world of chip preparation. Deep insight into amateur- as well as professional methods and equipment is given, for the first, most important steps for analysis and attackz on dedicated hardware."|"https://events.ccc.de/congress/2014/Fahrplan/schedule.xml"|""
"2014"|"31C3"|"Serenität – Anleitung zum Glücklichsein"|"Die radikalen philosophischen Texte von Elektra W. haben das Ziel - seien wir offen und direkt - einen Headcrash des Ich-Erlebens herbeizuführen, das sich im Laufe unserer Enkulturation und Erziehung im Vorderlappen des Großhirns breit gemacht hat. "|"https://events.ccc.de/congress/2014/Fahrplan/schedule.xml"|""
"2014"|"31C3"|"Programming with dependent types in Idris: The next big privacy heist"|"Idris is a relatively young research programming languages that attempts to bring dependent types to general purpose programming. In this talk I will introduce the concept of dependent types and the Curry-Howard isomorphism and how these can be applied to prove properties about software and eradicate whole classes of bugs and securityz issues."|"https://events.ccc.de/congress/2014/Fahrplan/schedule.xml"|""
"2014"|"31C3"|"The automobile as massive data gathering source and the consequences for individual privacy: or how we learned to stop worrying and love the NSA"|"We report about a LOAD e. V. study regarding data collection of cars, future developments of this technology field, how this data is accessed and securityzd and what the stakeholders (car manufacturers, car owners and users)  positions are on this data gathering. In a summary we outline necessary consequences."|"https://events.ccc.de/congress/2014/Fahrplan/schedule.xml"|""
"2014"|"31C3"|"Long war tactics: Lessons learned from crowdfunding a hardware project"|"Referring to the seminal talk Dymaxion gave at the closing of the NoisySquare at OHM in 2013. This talk will explore what has happened and what has not in the mean time on the ""battle ground"". An overview will be presented on the technical, legal, political and social battles going on and will provide pointers to further tactics. Finally we will look at how to make sure we keep ourselves safe and sane."|"https://events.ccc.de/congress/2014/Fahrplan/schedule.xml"|""
"2014"|"31C3"|"Mr Beam goes Kickstarter: open source DIY brain-computer-interfaces | technology and applications crash-course | ""BCI Mind-hackz"" intro"|"Mr Beam was started as a hobby project aiming to get more experience in 3D printing. For fun we put it on Kickstarter and ended up in kind of a roller coaster. "|"https://events.ccc.de/congress/2014/Fahrplan/schedule.xml"|""
"2014"|"31C3"|"Open-BCI DIY-Neuroscience Maker-Art Mind-hackz"|"leading hackzs and researchers from the worldwide hackzspace,  universitiy, and DIY artist community,  explain current technological  possibilites in BCI,   and show ways to use open source  hardware and software  for hackzs, makers, artists,  personal development, citizen science,   providing a framework for alternative culture and free expression  balancing the soon coming commercial expansion  in ""Neurogaming"", ""Neuromarketing"" and ""eHealth""   talk will illustrate  the mutually beneficial relationship  between ""hackz"" and science,  with the example of hackz BCIs,   as well as an overview into the new field of ""BCI Mind-hackz"", such as securityzing  remote consumer Neuroheadsets,  and Data-Mining the human-brain  for sensitive data during casual use.  "|"https://events.ccc.de/congress/2014/Fahrplan/schedule.xml"|""
"2014"|"31C3"|"Preserving arcade games"|"Old-school arcade games were so protected that hackz is the only way to preserve them before all boards are dead, and the games are lost."|"https://events.ccc.de/congress/2014/Fahrplan/schedule.xml"|""
"2014"|"31C3"|"Too Many Cooks - securityzing the Internet-of-TR-069-Things: The art of making a free phonebox and the culture of anonymous communication"|"TL;DR We unravel the story of a bug that would become one of the most important securityz released this year. Also, we have free cookies. The findings we published earlier this year demystified the voodoo that is TR-069, demonstrated how mass pwnage can be achieved via server-side attackz, and proved the landscape is ripe for harvesting. We will continue where we left off to explore TR-069 client-side securityz; we analyze client implementations, pour some insight into mysterious results from our internet-wide scans, and follow to mass pwnage through remote code execution on millions of online devices. again. "|"https://events.ccc.de/congress/2014/Fahrplan/schedule.xml"|""
"2014"|"31C3"|"Superheroes Still Need Phoneboxes"|"This talk asks how we might plan for the continuation of a privacy sustaining internet in light of growing trends in enforced identity checking and demonisation of everyday anonymity. It presents a 'free phonebox' project, which was tested at the FutureEverything art and technology festival in 2014, as an example of a social-technical system that promotes identity ambiguity in communication through the sharing of 'free' mobile phone minutes between strangers."|"https://events.ccc.de/congress/2014/Fahrplan/schedule.xml"|""
"2014"|"31C3"|"Freedom in your computer and in the net"|"For freedom in your own computer, the software must be free. For freedom on the internet, we must organize against surveillance, censorship, SaaSS and the war against sharing."|"https://events.ccc.de/congress/2014/Fahrplan/schedule.xml"|""
"2014"|"31C3"|"Jahresrückblick des CCC: Der Protest gegen TTIP und CETA"|"Auch das Jahr 2014 geht irgendwann vorbei. Deshalb werfen wir einen Blick zurück auf die für uns besonders relevanten Themen und versuchen abzuschätzen, was im Jahr 2015 auf uns zukommen könnte."|"https://events.ccc.de/congress/2014/Fahrplan/schedule.xml"|""
"2014"|"31C3"|"Deine Rechte sind in diesen Freihandelsabkommen nicht verfügbar"|"Die Kritik am Freihandelsabkommen TTIP und CETA auf die Chlorhühnchen zu beschränken, greift viel zu kurz. Denn bei den beiden Abkommen zwischen der EU und den USA und der EU und Kanada steht noch viel mehr auf dem Spiel. Egal ob Datenschutz, Demokratie oder Urheberrecht – Abkommen, an denen Konzerne unter Ausschluss der Öffentlichkeit mitschreiben können, sind selten eine gute Idee. Sitzungsdokumente mit “unverbindlichen” Lobby-Vorschlägen und Leaks der Vertragstexte lassen wenig Gutes erwarten. Datenschutzstandards laufen Gefahr zu Handelshemmnissen erklärt zu werden. Konzerne pochen darauf, Staaten vor außerstaatlichen Schiedsgerichten auf Schadensersatz verklagen zu können. Was die Bürger wollen, wurde im ganzen Verhandlungsprozess der beiden Freihandelsabkommen nicht einmal gefragt. Doch “Klicktivismus” war gestern – neue Strategien und Tools halfen dabei, eine Welle des dezentralen Protests loszutreten. "|"https://events.ccc.de/congress/2014/Fahrplan/schedule.xml"|""
"2014"|"31C3"|"DP5: PIR for Privacy-preserving Presence"|"In the wake of the Snowden revelations and the explicit targetting of address book and buddy list information, social service providers may wish to actively avoid learning which of its users are friends.  In this talk, we will introduce the workings of a surprising technology called private information retrieval, or PIR. Then, we will describe its use in DP5, a new suite of privacy-preserving presence protocols that allow people to determine when their friends are online (and to establish securityz communications with them), without a centralized provider ever learning who is friends with whom."|"https://events.ccc.de/congress/2014/Fahrplan/schedule.xml"|""
"2014"|"31C3"|"Thunderstrike: EFI bootkits for Apple MacBooks: Neue Energie für die Informationsfreiheit"|"In this presentation we demonstrate Thunderstrike, a vulnerability that allows the installation of persistent firmware modifications into the EFI boot ROM of Apple's popular MacBooks.  The bootkit can be easily installed by an evil-maid via the externally accessible Thunderbolt ports and can survive reinstallation of OSX as well as hard drive replacements.  Once installed, it can prevent software attempts to remove it and could spread virally across air-gaps by infecting additional Thunderbolt devices."|"https://events.ccc.de/congress/2014/Fahrplan/schedule.xml"|""
"2014"|"31C3"|"IFG – Mit freundlichen Grüßen: A Bus Trip into the Surveillance Culture of Berlin One Year After Snowden"|"Die interessantesten IFG-Geschichten des Jahres mit Anfragen und Ablehnungen, Klagen und Kampagnen. Außerdem: wie wir mit Hilfe des Journalismus der Informationsfreiheit neuen Antrieb geben werden!"|"https://events.ccc.de/congress/2014/Fahrplan/schedule.xml"|""
"2014"|"31C3"|"The Magical Secrecy Tour "|"June 5, 2014 marked one year since leaks by NSA whistleblower Edward Snowden began to be introduced to a worldwide public. On this date, transmediale teamed up with N.K. Projekt and Leslie Dunton-Downer, 2014 fellow at The American Academy in Berlin, for the Magical Secrecy Tour, a bus journey exploring Berlin as the global capital of informed response to mass surveillance. This inside look at the project features first-ever screening of footage shot by filmmaker Simon Klose (TPB AFK) for his documentary about the tour."|"https://events.ccc.de/congress/2014/Fahrplan/schedule.xml"|""
"2014"|"31C3"|"The Perl Jam: securityzing a 20 Year-old Vulnerability"|"tl;dr securityz ALL THE PERL. We chained several of Perl’s ridiculous syntax quirks in order to create a surprisingly powerful attackz, bringing down some of the most popular Perl-based projects in the world to their knees. Brace yourselves, RCE securityzs are coming."|"https://events.ccc.de/congress/2014/Fahrplan/schedule.xml"|""
"2014"|"31C3"|"UNHash - Methods for better password cracking: Several failure modes of the hackz scene"|"This talk will show a new method for password cracking called UNHash. UNHash as a tool uses rulefiles that are something in between of a DSL (Domain specific language) and a python script to describe the password cracking process. This talk will show how to mix web service abuse, knowledge of human nature and data mining to enable far better attackz against passwords. We will be focusing on a few features: cracking default passwords on network systems with minimal effort, testing for embedded backdoors and offline attackz by data mining and modeling about 33 million user account to gain insight in how users choose their passwords and how can we use that knowledge to speed up password cracking for 20% more gain for non pseudorandom passwords."|"https://events.ccc.de/congress/2014/Fahrplan/schedule.xml"|""
"2014"|"31C3"|"Infocalypse now: P0wning stuff is not enough: Neue Spiele, neue Musik und noch mehr Luftballons"|"This speech about how the hackz scene is failing its own ideals and what questions must be addressed to make a real difference."|"https://events.ccc.de/congress/2014/Fahrplan/schedule.xml"|""
"2014"|"31C3"|"Googlequiz – 2015er Edition: Vortrag mit aktuellen Fotos aus luftigen Perspektiven"|"Beim Googlequiz spielen max. 7 Teams mit je max. 7 Spielern gegeneinander. Sie dürfen dabei nicht Google benutzen. Es ist eine recht spaßorientierte Angelegenheit, so dass auch Zuschauer willkommen sind."|"https://events.ccc.de/congress/2014/Fahrplan/schedule.xml"|""
"2014"|"31C3"|"NSA Points of Presence in AT: Understanding the architecture of a quantum processor"|" - Station VIENNA in der US-Botschaft 1090 Wien -  VIENNA  ANNEX  beim UNO-Sitz in Wien 1220 - Legacy Standort „NSA-Villa“ Wien 1180  - Relaystation Exelberg,Breitbandnetz von NSA/SCS  über Wien   - Equipment und Funktion der FORNSAT-Station Königswarte."|"https://events.ccc.de/congress/2014/Fahrplan/schedule.xml"|""
"2014"|"31C3"|"Let's build a quantum computer!: European copyright reform is finally on the horizon"|"I will explain why quantum computing is interesting, how it works and what you actually need to build a working quantum computer. I will use the superconducting two-qubit quantum processor I built during my PhD as an example to explain its basic building blocks. I will show how we used this processor to achieve so-called quantum speed-up for a search algorithm that we ran on it. Finally, I will give a short overview of the current state of superconducting quantum computing and Google's recently announced effort to build a working quantum computer in cooperation with one of the leading research groups in this field."|"https://events.ccc.de/congress/2014/Fahrplan/schedule.xml"|""
"2014"|"31C3"|"Correcting copywrongs"|"After years of debate, EU copyright law is finally being revisited. The Commission will present a proposal for reform within 4 months of 31c3. And it's high time: There has never been a bigger discrepancy between the technical feasibility to share information and knowledge across all physical borders and the legal restrictions to actually do so. This talk outlines the unique opportunity and the challenge to bring copyright into the 21st century that lies in front of us. hackzs ensured that people were heard during last winter's public consultation. Can they now also ensure a progressive outcome of the reform process?"|"https://events.ccc.de/congress/2014/Fahrplan/schedule.xml"|""
"2014"|"31C3"|"EMET 5.1 - Armor or Curtain?: Politics and Physics of a Problem That's Not Going Away"|"EMET (Enhanced Mitigation Experience Toolkit) is an application which can be used to further harden a Windows system by adding additional securityz protections to running processes. These protections include several ROP (Return-Oriented-Programming) checks, shellcode detection mechansims, heap-spray mitigations and many more. The talk covers techniques to bypass EMET 5.1 (the current version) and shows the audience how hard/easy it is for an attackzer to accomplish this."|"https://events.ccc.de/congress/2014/Fahrplan/schedule.xml"|""
"2014"|"31C3"|"What Ever Happened to Nuclear Weapons?: How many windows are open in the patent fortress"|"An overview of 70 years of nuclear weapons, focusing on some of the underlying physics, the international politics that surround the topic, modern technology for nuclear weapons detection and monitoring, and what everyone can do to help nuclear disarmament."|"https://events.ccc.de/congress/2014/Fahrplan/schedule.xml"|""
"2014"|"31C3"|"The Maker movement meets patent law: From war pigeons in 1914 to cyborg moths in 2014"|"The Maker movement and patent law are like two planets moving on the orbit of innovations. Occasionally, they collide … because the Maker planet moves too fast. But, back on the Earth. Encounters with patent law can be of many reasons, e.g. filing a patent application or being blocked in making by a patent (or much worse, being accused of a patent infringement). The latter motivated the question of the permissible uses of patented inventions. The talk explains which activities on patents are lawful and keep Makers safe in their making. "|"https://events.ccc.de/congress/2014/Fahrplan/schedule.xml"|""
"2014"|"31C3"|"Living Drones: A view into technology on the other side of the world"|"During World War I, homing pigeons were used to carry messages and take photographs over enemy territory. Today, experiments are being conducted to remote-control insects for similar purposes. This talk intends to give an overview of 100 years of living drones, speculate on future developments in the field, and question the ethical implications of the practice."|"https://events.ccc.de/congress/2014/Fahrplan/schedule.xml"|""
